0	1	a	Goodfellow's theory has been questioned, however, because the plane made two other sharp turns that would've been impossible if the pilots were unconscious.
1	1	a	However, both campaigners and pro-People's Vote MPs say that this number would be grow significantly if there were no other viable means of avoiding leaving the EU without a Withdrawal Agreement.
2	1	a	Things could have been even better if the whole chip industry wasn't constrained by chip foundries such as Taiwan Semiconductor Manufacturing (NYSE: TSM) and United Microelectronics getting swamped under more orders than they can handle.
3	0	a	The new request, if approved, would keep the military forces on the border through Jan.
4	0	a	Companies in financial difficulty can currently only negotiate down wages and conditions to below those established by the collective bargaining procedure if they have the approval of unions, which is rarely given.
5	0	a	If needed, I would like to have the right to try.
6	0	a	In a REIT situation, the operating companies would have to fund operations without the backing of real estate, and if revenue declines, they could see profits and debt funding dry up.
7	0	a	If Mr McCain is in charge, his record of bipartisan outreach will stand him in good stead; Mr Obama will be able to rely on solid majorities in Congress.
8	0	a	Regulatory measures may be considered if private sector efforts are not implemented.
9	0	a	A vote outside of the normal meeting time can come up if the SEC is racing to beat the statute of limitations on filing a charge, the source said.
10	0	a	Folks might not have felt like paying $10 a ticket to see films that have proven to be rather disappointing at the box office, like Cinderella Man or Kingdomof Heaven, but it stands to reason -- as has always been the case -- that many people will probably rent them, or even buy them, on DVD.
11	0	a	Once you're in, restaurants will have enough information to treat you like a regular even if it's the first time you've walked through the door.
12	0	a	With a shrinking pool of peers, nurses will be able to leverage their talent to work on their terms; if they feel they are becoming burned out in their current position, they will do what Sharon did, repeatedly: pursue other opportunities.
13	0	a	If the court then permits the case to move forwardnot a certainty, given the novel constitutional claims at stakethe clash will turn to whether the plaintiffs may force Mr Trump to hand over tax returns as evidence of his business ties.
14	0	a	The C.D.C. says that even if young people have already had sex before they get the vaccine, it can still provide some protection..
15	0	a	If the Supreme Court rules that the text of the ACA does not allow for states using a federally run exchanges to receive subsidies, these people would lose critical financial assistance.
16	0	a	Patients can reasonably shop only for care that is for nonemergencies and would be motivated to do so only if they stood to gain.
17	1	a	In addition, the computer users often continued to work without taking breaks, but in other circumastance, if the users took the breaks itt would have relieved the additional tension and reduced the risk of developing repetitive strain injury.
18	0	a	Regulators can prevent a bank from buying back shares or paying dividends if they think those steps would pose risks to the firm's stability or if they take issue with the bank's capital planning process.
19	0	a	No party other than the Left Party would oppose smart sanctions if Iran rejected the western package of incentives for it to remain non-nuclear.
20	0	a	Unable to stay completely quiet on the issue, Merkel said last week Britain would lose out if it left the EU.
21	0	a	But, reflecting Republican divisions, he acknowledged that subsidies - even if directed at low-income baby boomers - would be tricky given opposition from conservatives such as House Freedom Caucus Chairman Mark Meadows (R-N.C.).
22	0	a	We will let you know over the next week if it looks like that might change.
23	0	a	"Earlier this week Fitch said it would cut its sovereign credit rating for the United States next year if Washington cannot come to grips with its deficits and create a ""credible"" fiscal consolidation plan."
24	0	a	Information may be withheld if it could have an adverse effect on defence, public security or tax collection.
25	0	a	The spokesman for WIS said WIS expenses were paid through business cards tied to a few senior officials of the firm, including Mr. Reynaga, meaning that Mr. Reynaga could have been paying for other employees' costs..
26	0	a	If the commission thinks such initiatives are dangerous, it may decline to act, though then it will have to explain why it has ignored a million signatures.
27	0	a	"However, I will give the Fed an A; Treasury B-minus and the SEC up until the last few days a F."" On expected market reaction: ""I could see this could have legs and we could have a powerful year-end rally."" MARK WAGGONER PRESIDENT AT EXCEL FUTURES INC, HUNTINGTON BEACH, CALIFORNIA: ""It's giving them a lot of breathing room to do a lot of stuff and it is extremely vague."
28	1	a	Supposing economic estimates produced figures showed that making meaningful climate change mitigation efforts would entail lowering global GDP by 80%, no one would have made any effort on making a change.
